{
  "spec_version": "0.1",
  "run_id": "editorial-demo-001",
  "producer": {
    "id": "small-publisher",
    "name": "Harbour Community Brief"
  },
  "created_at": "2026-08-09T09:31:09.172686Z",
  "public_key_fingerprint": "772d2efd650c941ffbd433dc11820f121d3ce605a15f179d68ad5948b31a5be2"
}
